{
  "moduleId": "fenofibrate",
  "version": 1,
  "blocks": [
    {
      "id": "fen-b1",
      "title": "The medicine and its story",
      "lessons": [
        "fen-l01-at-a-glance",
        "fen-l02-how-it-works",
        "fen-l03-history"
      ]
    },
    {
      "id": "fen-b2",
      "title": "The label in practice",
      "lessons": [
        "fen-l04-approved-uses",
        "fen-l05-strengths-products",
        "fen-l06-how-taken"
      ]
    },
    {
      "id": "fen-b3",
      "title": "The evidence",
      "lessons": [
        "fen-l07-reading-a-trial",
        "fen-l08-pivotal-trials",
        "fen-l09-combination-trials",
        "fen-l10-cv-outcomes"
      ]
    },
    {
      "id": "fen-b4",
      "title": "Safety and guidelines",
      "lessons": [
        "fen-l11-side-effects",
        "fen-l12-contraindications-interactions",
        "fen-l13-pharmacovigilance",
        "fen-l14-esc-guidelines"
      ]
    }
  ],
  "units": [
    {
      "id": "rv-fen-l01",
      "level": "lesson",
      "covers": [
        "fen-l01-at-a-glance"
      ],
      "summary": {
        "title": "Fenofibrate at a glance",
        "points": [
          "A fibrate: mainly lowers triglycerides. One tablet a day, on top of diet, exercise and weight loss.",
          "Three uses: severe hypertriglyceridaemia; mixed hyperlipidaemia when a statin isn't possible; added to a statin in high-risk mixed hyperlipidaemia.",
          "Lipid ranges: triglycerides −40–55%, HDL +10–30%, given without comparator or time point.",
          "Outcomes are modest: ACCORD-Lipid wasn't significant, and death from any cause hasn't been shown to fall.",
          "Watch liver, muscles (more with a statin), kidneys, pancreas and gallbladder."
        ]
      },
      "exercises": [
        {
          "id": "ex1",
          "kind": "apply",
          "scenario": "A GP wants to start Secalip Supra as the first treatment for a patient with ordinary high LDL.",
          "questions": [
            {
              "type": "mcq",
              "prompt": "What does the SmPC say?",
              "options": [
                "Allowed, provided LDL is checked again after four weeks",
                "Not an approved use; it isn't first-line for that",
                "Fine, as long as diet continues alongside",
                "Only acceptable in patients under 18"
              ],
              "answer": 1,
              "explanation": "Fenofibrate can be first only in severe hypertriglyceridaemia, or when a statin isn't possible."
            },
            {
              "type": "mcq",
              "prompt": "When can fenofibrate be used alone for mixed hyperlipidaemia?",
              "options": [
                "When a statin is contraindicated or not tolerated",
                "Only once a statin and ezetimibe have both been tried and failed",
                "Only in type 2 diabetes",
                "Always, as first-line"
              ],
              "answer": 0,
              "explanation": "It stands in for the statin when the statin can't be used."
            }
          ]
        },
        {
          "id": "ex2",
          "kind": "connect",
          "scenario": "A partner's sales deck says 'fenofibrate reduces cardiovascular deaths'.",
          "questions": [
            {
              "type": "mcq",
              "prompt": "How does the SmPC put it?",
              "options": [
                "Clearly reduces cardiovascular and total deaths",
                "Silent on outcomes; section 5.1 gives lipid changes only",
                "May reduce coronary events; not shown to cut deaths",
                "Shown to increase deaths in people with diabetes"
              ],
              "answer": 2,
              "explanation": "The lipid numbers look strong; the outcome picture is modest."
            },
            {
              "type": "mcq",
              "prompt": "ACCORD-Lipid showed 2.2% vs 2.4% events per year. Why isn't this a proven benefit?",
              "options": [
                "It was stopped early for benefit",
                "It only measured blood lipids",
                "It had no placebo comparison arm",
                "It wasn't statistically significant"
              ],
              "answer": 3,
              "explanation": "About 8% lower in relative terms, but not significant."
            }
          ]
        }
      ]
    },
    {
      "id": "rv-fen-l02",
      "level": "lesson",
      "covers": [
        "fen-l02-how-it-works"
      ],
      "summary": {
        "title": "How it works",
        "points": [
          "A prodrug: esterases convert it to fenofibric acid, the active form.",
          "Fenofibric acid activates PPARα: more lipoprotein lipase, less apolipoprotein C-III, faster triglyceride clearance.",
          "VLDL and LDL fall (fewer small dense particles); HDL rises.",
          "Take with food; half-life about 20 hours; cleared by the kidneys, not removed by dialysis.",
          "Micronised 160 mg replaces 200 mg capsules: milligrams alone don't tell you exposure."
        ]
      },
      "exercises": [
        {
          "id": "ex1",
          "kind": "apply",
          "scenario": "A pharmacist is switching a patient from Secalip 200 mg capsules to Secalip Supra 160 mg.",
          "questions": [
            {
              "type": "mcq",
              "prompt": "Does the dose need adjusting?",
              "options": [
                "No: the micronised form is absorbed better",
                "Yes: take two tablets to reach 200 mg",
                "Yes: the tablet is weaker than the capsule",
                "Only if kidney function is normal; otherwise stay on 200 mg"
              ],
              "answer": 0,
              "explanation": "Particle size changes how much is absorbed."
            },
            {
              "type": "mcq",
              "prompt": "Why does the label insist on taking it with a meal?",
              "options": [
                "To lower the half-life",
                "Absorption is higher with food",
                "Because it's metabolised by CYP3A4",
                "To prevent gallstones"
              ],
              "answer": 1,
              "explanation": "The PIL says it doesn't work as well on an empty stomach."
            }
          ]
        },
        {
          "id": "ex2",
          "kind": "connect",
          "scenario": "A colleague asks why fenofibrate is easier to combine with simvastatin than gemfibrozil is.",
          "questions": [
            {
              "type": "mcq",
              "prompt": "What's the pharmacokinetic reason?",
              "options": [
                "Fenofibrate is removed by dialysis, unlike gemfibrozil",
                "Fenofibrate carries no muscle risk with statins",
                "Fenofibrate lowers simvastatin levels by blocking CYP3A4 in the gut",
                "Fenofibrate isn't processed by CYP3A4 and doesn't block it"
              ],
              "answer": 3,
              "explanation": "That closes one interaction route, but the additive muscle risk remains."
            },
            {
              "type": "mcq",
              "prompt": "Which effect is only a marker, not proof of benefit?",
              "options": [
                "Fewer heart attacks in FIELD's primary result",
                "Fewer strokes in pooled fibrate trials",
                "A fall in CRP and uric acid",
                "Fewer deaths from any cause"
              ],
              "answer": 2,
              "explanation": "Changes in blood markers aren't outcomes."
            }
          ]
        }
      ]
    },
    {
      "id": "rv-fen-l03",
      "level": "lesson",
      "covers": [
        "fen-l03-history"
      ],
      "summary": {
        "title": "History",
        "points": [
          "French molecule (Fournier), in use since 1975; Lipanthyl in the EU, Tricor in the US from 1998.",
          "Many formulations: micronised, nanoparticle, prolonged-release; Secalip Supra authorised in Spain in 2000.",
          "2009 Article 31 referral: fibrates kept, but not first-line, except statin intolerance and severe hypertriglyceridaemia.",
          "Fenofibrate alone kept a statin add-on indication, based on ACCORD-Lipid; combinations Pravafenix (2011) and Cholib (2013) followed.",
          "The US withdrew fenofibric acid's statin add-on approval in 2016, from the same evidence."
        ]
      },
      "exercises": [
        {
          "id": "ex1",
          "kind": "apply",
          "scenario": "A US partner says: 'The FDA removed the statin add-on, so the EU indication must be gone too.'",
          "questions": [
            {
              "type": "mcq",
              "prompt": "What's accurate?",
              "options": [
                "The EU kept it; the US move was about fenofibric acid",
                "The EU also withdrew it in 2016",
                "Both regulators withdrew all fibrates",
                "The EU never had an add-on indication for fenofibrate"
              ],
              "answer": 0,
              "explanation": "Same trial data, different conclusions; Cholib remains authorised in the EU."
            },
            {
              "type": "mcq",
              "prompt": "What kind of procedure was the 2009 fibrate review?",
              "options": [
                "An Article 29 referral",
                "A centralised marketing application",
                "An Article 31 referral",
                "A periodic safety update assessment"
              ],
              "answer": 2,
              "explanation": "Triggered by the UK on 20 October 2009."
            }
          ]
        },
        {
          "id": "ex2",
          "kind": "connect",
          "scenario": "Why do Cholib and Pravafenix have EPARs but Secalip Supra doesn't?",
          "questions": [
            {
              "type": "mcq",